{
  "$schema": "https://json-schema.org/draft/2020-12/schema",
  "title": "Phone browser action plan v1 (design contract)",
  "description": "Host plan including screenshot nodes; not the ESP32 segment wire payload.",
  "type": "object",
  "additionalProperties": false,
  "properties": {
    "version": {
      "const": 1
    },
    "planId": {
      "type": "string",
      "pattern": "^[A-Za-z0-9][A-Za-z0-9._:-]{0,79}$"
    },
    "sessionId": {
      "type": "string",
      "pattern": "^[A-Za-z0-9][A-Za-z0-9._:-]{0,79}$"
    },
    "boardId": {
      "type": "string",
      "pattern": "^[A-Za-z0-9][A-Za-z0-9._:-]{0,79}$"
    },
    "targetId": {
      "type": "string",
      "pattern": "^[A-Za-z0-9][A-Za-z0-9._:-]{0,79}$"
    },
    "basedOnFrameId": {
      "description": "Exact short reference or frameId returned by a current-run observation.",
      "type": "string",
      "pattern": "^[A-Za-z0-9][A-Za-z0-9._:-]{0,79}$"
    },
    "orientationEpoch": {
      "type": "integer",
      "minimum": 0,
      "maximum": 2147483647
    },
    "ttlMs": {
      "type": "integer",
      "minimum": 1000,
      "maximum": 30000
    },
    "maxExecutionMs": {
      "type": "integer",
      "minimum": 100,
      "maximum": 15000
    },
    "steps": {
      "type": "array",
      "items": {
        "$ref": "#/$defs/step"
      },
      "minItems": 1,
      "maxItems": 30
    }
  },
  "required": [
    "version",
    "planId",
    "sessionId",
    "boardId",
    "targetId",
    "basedOnFrameId",
    "orientationEpoch",
    "ttlMs",
    "maxExecutionMs",
    "steps"
  ],
  "$defs": {
    "point": {
      "type": "object",
      "additionalProperties": false,
      "properties": {
        "x": {
          "type": "integer",
          "minimum": 0,
          "maximum": 10000
        },
        "y": {
          "type": "integer",
          "minimum": 0,
          "maximum": 10000
        }
      },
      "required": [
        "x",
        "y"
      ]
    },
    "pathPoint": {
      "type": "object",
      "additionalProperties": false,
      "properties": {
        "x": {
          "type": "integer",
          "minimum": 0,
          "maximum": 10000
        },
        "y": {
          "type": "integer",
          "minimum": 0,
          "maximum": 10000
        },
        "tMs": {
          "type": "integer",
          "minimum": 0,
          "maximum": 3000
        }
      },
      "required": [
        "x",
        "y",
        "tMs"
      ]
    },
    "frames": {
      "type": "object",
      "additionalProperties": false,
      "properties": {
        "count": {
          "type": "integer",
          "minimum": 1,
          "maximum": 8
        },
        "intervalMs": {
          "type": "integer",
          "minimum": 0,
          "maximum": 4000
        },
        "timeoutMs": {
          "type": "integer",
          "minimum": 100,
          "maximum": 10000
        }
      },
      "required": [
        "count",
        "intervalMs",
        "timeoutMs"
      ]
    },
    "tap": {
      "type": "object",
      "additionalProperties": false,
      "properties": {
        "id": {
          "type": "string",
          "pattern": "^[A-Za-z0-9][A-Za-z0-9._:-]{0,79}$"
        },
        "op": {
          "const": "tap"
        },
        "point": {
          "$ref": "#/$defs/point"
        },
        "holdMs": {
          "type": "integer",
          "minimum": 40,
          "maximum": 1200
        },
        "settleMs": {
          "type": "integer",
          "minimum": 0,
          "maximum": 3000,
          "description": "Host wait after confirmed HID release, before the next action or capture. Defaults: tap 250, key 150, home 1100, drag/pointer 350, swipe 700 ms. Increase for observed picker/inertial animation; use 0 for intentional double-tap/key sequences. This wait does not prove a fresh media frame or a settled UI."
        }
      },
      "required": [
        "id",
        "op",
        "point",
        "holdMs"
      ]
    },
    "drag": {
      "type": "object",
      "additionalProperties": false,
      "properties": {
        "id": {
          "type": "string",
          "pattern": "^[A-Za-z0-9][A-Za-z0-9._:-]{0,79}$"
        },
        "op": {
          "const": "drag"
        },
        "path": {
          "type": "array",
          "items": {
            "$ref": "#/$defs/pathPoint"
          },
          "minItems": 2,
          "maxItems": 128
        },
        "endHoldMs": {
          "type": "integer",
          "minimum": 0,
          "maximum": 500
        },
        "settleMs": {
          "type": "integer",
          "minimum": 0,
          "maximum": 3000,
          "description": "Host wait after confirmed HID release, before the next action or capture. Defaults: tap 250, key 150, home 1100, drag/pointer 350, swipe 700 ms. Increase for observed picker/inertial animation; use 0 for intentional double-tap/key sequences. This wait does not prove a fresh media frame or a settled UI."
        }
      },
      "required": [
        "id",
        "op",
        "path",
        "endHoldMs"
      ]
    },
    "swipe": {
      "type": "object",
      "additionalProperties": false,
      "properties": {
        "id": {
          "type": "string",
          "pattern": "^[A-Za-z0-9][A-Za-z0-9._:-]{0,79}$"
        },
        "op": {
          "const": "swipe"
        },
        "path": {
          "type": "array",
          "items": {
            "$ref": "#/$defs/pathPoint"
          },
          "minItems": 2,
          "maxItems": 128
        },
        "settleMs": {
          "type": "integer",
          "minimum": 0,
          "maximum": 3000,
          "description": "Host wait after confirmed HID release, before the next action or capture. Defaults: tap 250, key 150, home 1100, drag/pointer 350, swipe 700 ms. Increase for observed picker/inertial animation; use 0 for intentional double-tap/key sequences. This wait does not prove a fresh media frame or a settled UI."
        }
      },
      "required": [
        "id",
        "op",
        "path"
      ]
    },
    "pointerEvent": {
      "type": "object",
      "additionalProperties": false,
      "properties": {
        "phase": {
          "enum": [
            "down",
            "move",
            "up"
          ]
        },
        "x": {
          "type": "integer",
          "minimum": 0,
          "maximum": 10000
        },
        "y": {
          "type": "integer",
          "minimum": 0,
          "maximum": 10000
        },
        "atMs": {
          "type": "integer",
          "minimum": 0,
          "maximum": 3000
        }
      },
      "required": [
        "phase",
        "x",
        "y",
        "atMs"
      ]
    },
    "pointer": {
      "type": "object",
      "additionalProperties": false,
      "properties": {
        "id": {
          "type": "string",
          "pattern": "^[A-Za-z0-9][A-Za-z0-9._:-]{0,79}$"
        },
        "op": {
          "const": "pointer_sequence"
        },
        "events": {
          "type": "array",
          "items": {
            "$ref": "#/$defs/pointerEvent"
          },
          "minItems": 2,
          "maxItems": 130
        },
        "settleMs": {
          "type": "integer",
          "minimum": 0,
          "maximum": 3000,
          "description": "Host wait after confirmed HID release, before the next action or capture. Defaults: tap 250, key 150, home 1100, drag/pointer 350, swipe 700 ms. Increase for observed picker/inertial animation; use 0 for intentional double-tap/key sequences. This wait does not prove a fresh media frame or a settled UI."
        }
      },
      "required": [
        "id",
        "op",
        "events"
      ]
    },
    "motion": {
      "oneOf": [
        {
          "$ref": "#/$defs/drag"
        },
        {
          "$ref": "#/$defs/swipe"
        },
        {
          "$ref": "#/$defs/pointer"
        }
      ]
    },
    "capture": {
      "type": "object",
      "additionalProperties": false,
      "properties": {
        "id": {
          "type": "string",
          "pattern": "^[A-Za-z0-9][A-Za-z0-9._:-]{0,79}$"
        },
        "op": {
          "const": "capture"
        },
        "frames": {
          "$ref": "#/$defs/frames"
        },
        "review": {
          "type": "boolean"
        },
        "label": {
          "type": "string",
          "maxLength": 120
        }
      },
      "required": [
        "id",
        "op",
        "frames",
        "review",
        "label"
      ]
    },
    "observe": {
      "type": "object",
      "additionalProperties": false,
      "properties": {
        "id": {
          "type": "string",
          "pattern": "^[A-Za-z0-9][A-Za-z0-9._:-]{0,79}$"
        },
        "op": {
          "const": "observe"
        },
        "motion": {
          "$ref": "#/$defs/motion"
        },
        "frames": {
          "$ref": "#/$defs/frames"
        },
        "label": {
          "type": "string",
          "maxLength": 120
        }
      },
      "required": [
        "id",
        "op",
        "motion",
        "frames",
        "label"
      ]
    },
    "wait": {
      "type": "object",
      "additionalProperties": false,
      "properties": {
        "id": {
          "type": "string",
          "pattern": "^[A-Za-z0-9][A-Za-z0-9._:-]{0,79}$"
        },
        "op": {
          "const": "wait"
        },
        "durationMs": {
          "type": "integer",
          "minimum": 0,
          "maximum": 2000
        }
      },
      "required": [
        "id",
        "op",
        "durationMs"
      ]
    },
    "home": {
      "type": "object",
      "additionalProperties": false,
      "properties": {
        "id": {
          "type": "string",
          "pattern": "^[A-Za-z0-9][A-Za-z0-9._:-]{0,79}$"
        },
        "op": {
          "const": "home"
        },
        "settleMs": {
          "type": "integer",
          "minimum": 0,
          "maximum": 3000,
          "description": "Host wait after confirmed HID release, before the next action or capture. Defaults: tap 250, key 150, home 1100, drag/pointer 350, swipe 700 ms. Increase for observed picker/inertial animation; use 0 for intentional double-tap/key sequences. This wait does not prove a fresh media frame or a settled UI."
        }
      },
      "required": [
        "id",
        "op"
      ]
    },
    "key": {
      "oneOf": [
        {
          "type": "object",
          "additionalProperties": false,
          "properties": {
            "id": {
              "type": "string",
              "pattern": "^[A-Za-z0-9][A-Za-z0-9._:-]{0,79}$"
            },
            "op": {
              "const": "key"
            },
            "modifiers": {
              "type": "integer",
              "minimum": 0,
              "maximum": 255
            },
            "holdMs": {
              "type": "integer",
              "minimum": 40,
              "maximum": 1200
            },
            "settleMs": {
              "type": "integer",
              "minimum": 0,
              "maximum": 3000,
              "description": "Host wait after confirmed HID release, before the next action or capture. Defaults: tap 250, key 150, home 1100, drag/pointer 350, swipe 700 ms. Increase for observed picker/inertial animation; use 0 for intentional double-tap/key sequences. This wait does not prove a fresh media frame or a settled UI."
            },
            "key": {
              "type": "string",
              "pattern": "^(?:[A-Za-z0-9 ]|Enter|Escape|Backspace|Tab|Space|Insert|Home|PageUp|Delete|End|PageDown|ArrowRight|ArrowLeft|ArrowDown|ArrowUp)$",
              "description": "Literal English letter, digit, space or named keyboard key. Prefer this to calculating HID usage codes. Uppercase letters include Shift; keyboard Home differs from the phone home operation."
            }
          },
          "required": [
            "id",
            "op",
            "key",
            "modifiers",
            "holdMs"
          ]
        },
        {
          "type": "object",
          "additionalProperties": false,
          "properties": {
            "id": {
              "type": "string",
              "pattern": "^[A-Za-z0-9][A-Za-z0-9._:-]{0,79}$"
            },
            "op": {
              "const": "key"
            },
            "usage": {
              "type": "integer",
              "minimum": 4,
              "maximum": 231
            },
            "modifiers": {
              "type": "integer",
              "minimum": 0,
              "maximum": 255
            },
            "holdMs": {
              "type": "integer",
              "minimum": 40,
              "maximum": 1200
            },
            "settleMs": {
              "type": "integer",
              "minimum": 0,
              "maximum": 3000,
              "description": "Host wait after confirmed HID release, before the next action or capture. Defaults: tap 250, key 150, home 1100, drag/pointer 350, swipe 700 ms. Increase for observed picker/inertial animation; use 0 for intentional double-tap/key sequences. This wait does not prove a fresh media frame or a settled UI."
            }
          },
          "required": [
            "id",
            "op",
            "usage",
            "modifiers",
            "holdMs"
          ]
        }
      ]
    },
    "step": {
      "oneOf": [
        {
          "$ref": "#/$defs/tap"
        },
        {
          "$ref": "#/$defs/drag"
        },
        {
          "$ref": "#/$defs/swipe"
        },
        {
          "$ref": "#/$defs/pointer"
        },
        {
          "$ref": "#/$defs/capture"
        },
        {
          "$ref": "#/$defs/observe"
        },
        {
          "$ref": "#/$defs/wait"
        },
        {
          "$ref": "#/$defs/home"
        },
        {
          "$ref": "#/$defs/key"
        }
      ]
    }
  }
}
