{
  "version": 1,
  "planId": "plan-observe-during-motion",
  "sessionId": "session-demo",
  "boardId": "board-demo",
  "targetId": "phone-A",
  "basedOnFrameId": "frame-before",
  "orientationEpoch": 1,
  "ttlMs": 15000,
  "maxExecutionMs": 15000,
  "steps": [
    {
      "id": "observe-motion",
      "op": "observe",
      "label": "during-and-after-swipe",
      "motion": {
        "id": "swipe-motion",
        "op": "swipe",
        "path": [
          {
            "x": 5000,
            "y": 8000,
            "tMs": 0
          },
          {
            "x": 5000,
            "y": 5800,
            "tMs": 150
          },
          {
            "x": 5000,
            "y": 2500,
            "tMs": 280
          },
          {
            "x": 5000,
            "y": 1500,
            "tMs": 320
          }
        ]
      },
      "frames": {
        "count": 5,
        "intervalMs": 200,
        "timeoutMs": 5000
      }
    },
    {
      "id": "final",
      "op": "capture",
      "frames": {
        "count": 1,
        "intervalMs": 0,
        "timeoutMs": 5000
      },
      "review": true,
      "label": "settled-result"
    }
  ]
}
